{
  "schemaVersion": "1.0",
  "profileId": "JAPAN_PUBLIC_CROSS_PLATFORM_MAINNET_V1",
  "target": {
    "jurisdiction": "JP",
    "distribution": [
      "APPLE_APP_STORE",
      "GOOGLE_PLAY"
    ],
    "clientPlatforms": [
      "IOS",
      "ANDROID"
    ],
    "executionSurface": "STANDALONE_WALLET_ONLY",
    "capabilities": [
      "JPYC_HANDOFF",
      "SEND",
      "SPOT",
      "PERPETUAL",
      "CROSS_NETWORK_TRANSFER",
      "FEE_READINESS"
    ],
    "chatgptBoundary": "READ_ONLY_STATUS_GLOSSARY_GENERIC_SAFETY_AND_NEUTRAL_HANDOFF"
  },
  "releaseSubjectRequiredFields": [
    "sourceCommit",
    "sourceTreeSha256",
    "androidArtifactSha256",
    "iosArtifactSha256",
    "backendImageDigest",
    "signerImageDigest",
    "configurationBundleSha256",
    "policyBundleSha256",
    "assetRegistrySha256",
    "sbomSha256"
  ],
  "globalRules": {
    "currentPackageExpectedStatus": "BLOCKED_NOT_OPERATIONAL",
    "productionGoStatus": "PRODUCTION_OPERATIONAL_GO",
    "requireOutOfBandTrustPolicyHash": true,
    "requireOutOfBandCheckerHash": true,
    "requireOutOfBandReleaseSubjectHash": true,
    "requireTrustedTimeAttestation": true,
    "requireExactReleaseSubjectBinding": true,
    "requireIssuerReviewerSeparation": true,
    "requireEvidenceIndexSignature": true,
    "maxRuntimeLeaseSeconds": 300,
    "maxOperationAuthorizationSeconds": 120,
    "unknownOrConflictingEvidence": "BLOCK",
    "runtimeLeaseNeverAuthorizesTransaction": true,
    "maxTrustedTimeAttestationSeconds": 300,
    "maxEvidenceIndexAgeSeconds": 3600
  },
  "gates": [
    {
      "gateId": "SCOPE_AND_TRACEABILITY",
      "category": "PRODUCT",
      "titleJa": "提供範囲と要求追跡",
      "mandatory": true,
      "claims": [
        {
          "claimId": "SCOPE_LOCKED",
          "titleJa": "対象機能・対象地域・対象利用者・対象外を版固定",
          "issuerRoles": [
            "PRODUCT_OWNER"
          ],
          "reviewerRoles": [
            "RISK_OWNER"
          ],
          "approvalThreshold": 1,
          "maxAgeDays": 30,
          "evidenceTypes": [
            "SIGNED_REQUIREMENTS",
            "TRACEABILITY_MATRIX"
          ],
          "environments": [
            "PRODUCTION"
          ]
        },
        {
          "claimId": "REQUIREMENTS_TRACED",
          "titleJa": "全要求を実装・試験・証拠へ追跡",
          "issuerRoles": [
            "QUALITY_LEAD"
          ],
          "reviewerRoles": [
            "PRODUCT_OWNER"
          ],
          "approvalThreshold": 1,
          "maxAgeDays": 14,
          "evidenceTypes": [
            "TRACEABILITY_MATRIX",
            "TEST_REPORT"
          ],
          "environments": [
            "PRODUCTION"
          ]
        }
      ]
    },
    {
      "gateId": "ANDROID_RELEASE",
      "category": "MOBILE",
      "titleJa": "Android本番版",
      "mandatory": true,
      "claims": [
        {
          "claimId": "ANDROID_BUILD_SIGNED",
          "titleJa": "再現可能なrelease AAB/APKと署名・provenance",
          "issuerRoles": [
            "ANDROID_RELEASE_ENGINEER"
          ],
          "reviewerRoles": [
            "SUPPLY_CHAIN_REVIEWER"
          ],
          "approvalThreshold": 1,
          "maxAgeDays": 14,
          "evidenceTypes": [
            "BINARY",
            "BUILD_ATTESTATION",
            "SIGNING_REPORT"
          ],
          "environments": [
            "PRODUCTION"
          ]
        },
        {
          "claimId": "ANDROID_DEVICE_MATRIX",
          "titleJa": "対象実機・OS・大文字・TalkBack・IME・生体認証",
          "issuerRoles": [
            "MOBILE_QA"
          ],
          "reviewerRoles": [
            "ACCESSIBILITY_REVIEWER"
          ],
          "approvalThreshold": 1,
          "maxAgeDays": 14,
          "evidenceTypes": [
            "REAL_DEVICE_TEST_REPORT",
            "VIDEO_EVIDENCE"
          ],
          "environments": [
            "PRODUCTION"
          ]
        },
        {
          "claimId": "ANDROID_PLATFORM_SECURITY",
          "titleJa": "Keystore・端末完全性・overlay/root/debug対策",
          "issuerRoles": [
            "ANDROID_SECURITY_ENGINEER"
          ],
          "reviewerRoles": [
            "SECURITY_AUDITOR"
          ],
          "approvalThreshold": 1,
          "maxAgeDays": 30,
          "evidenceTypes": [
            "SECURITY_TEST_REPORT",
            "CONFIG_EXPORT"
          ],
          "environments": [
            "PRODUCTION"
          ]
        }
      ]
    },
    {
      "gateId": "IOS_RELEASE",
      "category": "MOBILE",
      "titleJa": "iPhone本番版",
      "mandatory": true,
      "claims": [
        {
          "claimId": "IOS_BUILD_SIGNED",
          "titleJa": "再現可能なarchive/IPAと署名・provenance",
          "issuerRoles": [
            "IOS_RELEASE_ENGINEER"
          ],
          "reviewerRoles": [
            "SUPPLY_CHAIN_REVIEWER"
          ],
          "approvalThreshold": 1,
          "maxAgeDays": 14,
          "evidenceTypes": [
            "BINARY",
            "BUILD_ATTESTATION",
            "SIGNING_REPORT"
          ],
          "environments": [
            "PRODUCTION"
          ]
        },
        {
          "claimId": "IOS_DEVICE_MATRIX",
          "titleJa": "対象実機・OS・大文字・VoiceOver・IME・生体認証",
          "issuerRoles": [
            "MOBILE_QA"
          ],
          "reviewerRoles": [
            "ACCESSIBILITY_REVIEWER"
          ],
          "approvalThreshold": 1,
          "maxAgeDays": 14,
          "evidenceTypes": [
            "REAL_DEVICE_TEST_REPORT",
            "VIDEO_EVIDENCE"
          ],
          "environments": [
            "PRODUCTION"
          ]
        },
        {
          "claimId": "IOS_PLATFORM_SECURITY",
          "titleJa": "Keychain/Secure Enclave・App Attest・jailbreak/debug対策",
          "issuerRoles": [
            "IOS_SECURITY_ENGINEER"
          ],
          "reviewerRoles": [
            "SECURITY_AUDITOR"
          ],
          "approvalThreshold": 1,
          "maxAgeDays": 30,
          "evidenceTypes": [
            "SECURITY_TEST_REPORT",
            "CONFIG_EXPORT"
          ],
          "environments": [
            "PRODUCTION"
          ]
        }
      ]
    },
    {
      "gateId": "BACKEND_RELEASE",
      "category": "BACKEND",
      "titleJa": "本番backend・取引Intent Parser・非取引Support Gateway",
      "mandatory": true,
      "claims": [
        {
          "claimId": "BACKEND_ARTIFACT_PINNED",
          "titleJa": "immutable image digest・migration・config版固定",
          "issuerRoles": [
            "BACKEND_RELEASE_ENGINEER"
          ],
          "reviewerRoles": [
            "SUPPLY_CHAIN_REVIEWER"
          ],
          "approvalThreshold": 1,
          "maxAgeDays": 14,
          "evidenceTypes": [
            "OCI_DIGEST",
            "DEPLOYMENT_MANIFEST",
            "MIGRATION_REPORT"
          ],
          "environments": [
            "PRODUCTION"
          ]
        },
        {
          "claimId": "BACKEND_POLICY_ENFORCED",
          "titleJa": "認証・rate/budget・schema・egress・取引Parser／非取引Support境界",
          "issuerRoles": [
            "BACKEND_SECURITY_ENGINEER"
          ],
          "reviewerRoles": [
            "SECURITY_AUDITOR"
          ],
          "approvalThreshold": 1,
          "maxAgeDays": 14,
          "evidenceTypes": [
            "INTEGRATION_TEST_REPORT",
            "POLICY_EXPORT"
          ],
          "environments": [
            "PRODUCTION"
          ]
        }
      ]
    },
    {
      "gateId": "DETERMINISTIC_CORE",
      "category": "CORE",
      "titleJa": "決定論的共通処理",
      "mandatory": true,
      "claims": [
        {
          "claimId": "CROSS_LANGUAGE_VECTORS",
          "titleJa": "Kotlin/Swift/serverが同じ正規化・十進数・hash・policy結果",
          "issuerRoles": [
            "CORE_ENGINEER"
          ],
          "reviewerRoles": [
            "QUALITY_LEAD"
          ],
          "approvalThreshold": 1,
          "maxAgeDays": 14,
          "evidenceTypes": [
            "CONFORMANCE_REPORT",
            "GOLDEN_VECTORS"
          ],
          "environments": [
            "PRODUCTION"
          ]
        },
        {
          "claimId": "OVERFLOW_ROUNDING_SAFE",
          "titleJa": "桁溢れ・負のゼロ・丸め・小数桁・locale差を拒否",
          "issuerRoles": [
            "CORE_ENGINEER"
          ],
          "reviewerRoles": [
            "SECURITY_AUDITOR"
          ],
          "approvalThreshold": 1,
          "maxAgeDays": 14,
          "evidenceTypes": [
            "PROPERTY_TEST_REPORT",
            "FUZZ_REPORT"
          ],
          "environments": [
            "PRODUCTION"
          ]
        }
      ]
    },
    {
      "gateId": "AUTH_SESSION_RECOVERY",
      "category": "IDENTITY",
      "titleJa": "認証・セッション・復旧",
      "mandatory": true,
      "claims": [
        {
          "claimId": "AUTHENTICATION_HARDENED",
          "titleJa": "phishing-resistant認証・短期session・再認証・端末binding",
          "issuerRoles": [
            "IDENTITY_ENGINEER"
          ],
          "reviewerRoles": [
            "SECURITY_AUDITOR"
          ],
          "approvalThreshold": 1,
          "maxAgeDays": 30,
          "evidenceTypes": [
            "THREAT_TEST_REPORT",
            "CONFIG_EXPORT"
          ],
          "environments": [
            "PRODUCTION"
          ]
        },
        {
          "claimId": "RECOVERY_DRILLED",
          "titleJa": "紛失・機種変更・生体変更・vendor停止・旧端末失効",
          "issuerRoles": [
            "CUSTODY_OPERATOR"
          ],
          "reviewerRoles": [
            "INDEPENDENT_OBSERVER"
          ],
          "approvalThreshold": 1,
          "maxAgeDays": 90,
          "evidenceTypes": [
            "RECOVERY_DRILL_REPORT",
            "VIDEO_EVIDENCE"
          ],
          "environments": [
            "PRODUCTION"
          ]
        },
        {
          "claimId": "ACCOUNT_TAKEOVER_RESPONSE",
          "titleJa": "乗っ取り検知・freeze・本人確認・異議申立て",
          "issuerRoles": [
            "FRAUD_LEAD"
          ],
          "reviewerRoles": [
            "RISK_OWNER"
          ],
          "approvalThreshold": 1,
          "maxAgeDays": 90,